{
    "name": "a-happy-tyler",
    "description": "Tyler is happy. Be like Tyler.",
    "keywords": [
        "tyler",
        "happy"
    ],
    "authors": [
        {
            "name": "Tyler Caslin",
            "email": "tylercaslin47@gmail.com",
            "url": "https://github.com/tc80"
        }
    ],
    "license": "MIT",
    "repository": {
        "type": "git",
        "url": "git://github.com/tc80/a-happy-tyler.git"
    },
    "filename": "happy.js",
    "version": "v1234"
}